{
  "@context": "https://obligationfirst.org/v1/context.jsonld",
  "@type": "of:Determination",
  "@id": "https://obligationfirst.org/v1/examples/publedge-jia-utah-72/determination/oaip-jia-2026-001-issuance",
  "issued_date": "2026-04-15",
  "issuedBy": "https://obligationfirst.org/v1/examples/publedge-jia-utah-72/authority/oaip",
  "decides": [],
  "disposition": "issued",
  "target_instrument": "https://obligationfirst.org/v1/examples/publedge-jia-utah-72/instrument/oaip-jia-2026-001",
  "notes": "Issuance event for the Utah Mental Health Chatbot Disclosure JIA. Disposition 'issued' marks the act of promulgating the JIA itself; decides is empty by design because this Determination promulgates an Instrument rather than ruling on Allegations."
}
